{
  "program_id": "11111111-1111-4111-8111-111111111111",
  "current_plan_id": "22222222-2222-4222-8222-222222222222",
  "current_plan_version": 1,
  "expected_state_version": 3,
  "trigger": {
    "source_kind": "synthetic_contract_fixture",
    "source_ref": "33333333-3333-4333-8333-333333333333",
    "summary": "The available weekly time in the synthetic fixture decreased from eight hours to four hours."
  },
  "constraints": [
    {
      "constraint_id": "weekly-time-cap",
      "category": "time",
      "description": "Use no more than four hours per week.",
      "immutable": true
    },
    {
      "constraint_id": "evidence-integrity",
      "category": "safety",
      "description": "Do not invent or weaken evidence requirements.",
      "immutable": true
    }
  ]
}
